{"schema":"legacyforge-native-capability-receipt-v1","case_id":"D06-HW01","source_commit":"a3f72874241914f6048d4ca9ec4fc0edc978625d","build_id":"20261017-173106-d79a3eae","production_comparison_commit":"d1453434ceefe73bef5aff497194e09f39dde7e1","frozen_d00_reference_commit":"553c6554f40f1372b0ea09f6badbbb98e133a9ab","package_name":"AlgorHome.LegacyForge.NativeDiagnostics","package_publisher":"CN=LegacyForgeDiagnostics","package_version":"0.2.0.0","architecture":"x64","application_id":"App","expected_package_identity":true,"run_id":"594ACA53-FC63-4709-9C8B-BE96BEDD84BD","process_instance_id":"FB83C3BE-785B-4D9F-98CF-444025A0C12D","java_jni_enabled":false,"minecraft_or_gameplay_tested":false,"all_d06_certified":false,"hardware_device_requested":true,"watchdog_cancels_native_calls":false,"payload_hashes":{"executable_sha256":"61ba742e8022c6874af7364c022289157c887da5d6035201f4aa61dba7ca02d0","manifest_sha256":"b107ba9665b0eb35d640cb5f7ff43b96ec2071d341feca0d5bfc3343eb98b7a4","build_inputs_sha256":"13a52990281afbbbca0c2e83f903216e7dd46791253f5e7154f6a16757d1c03b","policy_sha256":"01561fdb7ff95df0d502659b7ab3c5065a8c9f681c4d5ed38db7053a9f837cac","schema_sha256":"db311c43104e3940cd7299a495b3ac2a5a0440cb8b3af06cbb5ba1314a4331e1","inventory_sha256":"642a0d0826deb138fb61fdbcedf02718e83d0938b3960a00c0c1ffc848354bb4"},"status":"PASS","reason":"HARDWARE_DEVICE_CREATED_AND_CLASSIFIED","stage":"FINAL","terminal":true,"sequence":3,"elapsed_monotonic_ms":94,"deadline_ms":10000,"observed_at_utc":"2026-10-17T22:42:23.639Z","last_durable_checkpoint_stage":"BEFORE_CREATE_DEVICE","receipt_persistence_result":"VERIFY_BY_RETRIEVAL","details":{"requested_driver_type":"HARDWARE","requested_driver_type_value":1,"requested_feature_level":45056,"creation_flags":32,"software_fallback_allowed":false,"render_or_present_tested":false,"memory_before":{"usage_bytes":4911104,"limit_bytes":1073741824,"available":true},"creation_hresult":"0x00000000","creation_hresult_signed":0,"selected_feature_level":45056,"device_returned":true,"context_returned":true,"get_adapter_hresult":"0x00000000","get_desc_hresult":"0x00000000","adapter_flags":0,"adapter_software_flag":false,"test_resources_released":true,"memory_after_release":{"usage_bytes":9482240,"limit_bytes":1073741824,"available":true}}}